[
  { "id": "climate-01", "month": 1, "high": 5.4, "low": -2.9, "precip": 27, "source": { "title": "Wikipedia — Plovdiv (climate)", "url": "https://en.wikipedia.org/wiki/Plovdiv", "accessed_at": "2026-06-20" } },
  { "id": "climate-02", "month": 2, "high": 8.5, "low": -1.5, "precip": 34, "source": { "title": "Wikipedia — Plovdiv (climate)", "url": "https://en.wikipedia.org/wiki/Plovdiv", "accessed_at": "2026-06-20" } },
  { "id": "climate-03", "month": 3, "high": 13.5, "low": 2.1, "precip": 37, "source": { "title": "Wikipedia — Plovdiv (climate)", "url": "https://en.wikipedia.org/wiki/Plovdiv", "accessed_at": "2026-06-20" } },
  { "id": "climate-04", "month": 4, "high": 18.7, "low": 6.5, "precip": 41, "source": { "title": "Wikipedia — Plovdiv (climate)", "url": "https://en.wikipedia.org/wiki/Plovdiv", "accessed_at": "2026-06-20" } },
  { "id": "climate-05", "month": 5, "high": 24.0, "low": 11.3, "precip": 77, "source": { "title": "Wikipedia — Plovdiv (climate)", "url": "https://en.wikipedia.org/wiki/Plovdiv", "accessed_at": "2026-06-20" } },
  { "id": "climate-06", "month": 6, "high": 28.7, "low": 15.3, "precip": 57, "source": { "title": "Wikipedia — Plovdiv (climate)", "url": "https://en.wikipedia.org/wiki/Plovdiv", "accessed_at": "2026-06-20" } },
  { "id": "climate-07", "month": 7, "high": 31.4, "low": 17.3, "precip": 39, "source": { "title": "Wikipedia — Plovdiv (climate)", "url": "https://en.wikipedia.org/wiki/Plovdiv", "accessed_at": "2026-06-20" } },
  { "id": "climate-08", "month": 8, "high": 31.6, "low": 17.2, "precip": 43, "source": { "title": "Wikipedia — Plovdiv (climate)", "url": "https://en.wikipedia.org/wiki/Plovdiv", "accessed_at": "2026-06-20" } },
  { "id": "climate-09", "month": 9, "high": 26.3, "low": 13.0, "precip": 35, "source": { "title": "Wikipedia — Plovdiv (climate)", "url": "https://en.wikipedia.org/wiki/Plovdiv", "accessed_at": "2026-06-20" } },
  { "id": "climate-10", "month": 10, "high": 19.6, "low": 7.6, "precip": 37, "source": { "title": "Wikipedia — Plovdiv (climate)", "url": "https://en.wikipedia.org/wiki/Plovdiv", "accessed_at": "2026-06-20" } },
  { "id": "climate-11", "month": 11, "high": 12.5, "low": 3.0, "precip": 36, "source": { "title": "Wikipedia — Plovdiv (climate)", "url": "https://en.wikipedia.org/wiki/Plovdiv", "accessed_at": "2026-06-20" } },
  { "id": "climate-12", "month": 12, "high": 6.5, "low": -1.4, "precip": 39, "source": { "title": "Wikipedia — Plovdiv (climate)", "url": "https://en.wikipedia.org/wiki/Plovdiv", "accessed_at": "2026-06-20" } }
]
